{"answers":[{"answer_class":"forced","contradiction_refs":[],"feasible_alternative_refs":[],"subject_ref":"subject:nport:cusip-037833100:isin-US0378331005:period-2024-09-30","support_refs":["artifact:blake3:1111111111111111111111111111111111111111111111111111111111111111"],"value_ref":"artifact:blake3:2222222222222222222222222222222222222222222222222222222222222222"}],"assumptions":["placeholder identifiers are normalized before identity comparison"],"budget":{"consumed":{"bytes":870000000,"cost_units":3120,"human_reviews":20,"model_tokens":0,"source_calls":2048},"remaining":{"bytes":19130000000,"cost_units":6880,"human_reviews":480,"model_tokens":0,"source_calls":97952}},"closure_refs":{"closure_root_hash":"blake3:aaaaaaaaaaaaaaaaaaaaaaaaaaaaaaaaaaaaaaaaaaaaaaaaaaaaaaaaaaaaaaaa","declaration_hashes":["blake3:bbbbbbbbbbbbbbbbbbbbbbbbbbbbbbbbbbbbbbbbbbbbbbbbbbbbbbbbbbbbbbbb","blake3:cccccccccccccccccccccccccccccccccccccccccccccccccccccccccccccccc"],"grant_hash":"blake3:dddddddddddddddddddddddddddddddddddddddddddddddddddddddddddddddd","inquiry_hash":"blake3:eeeeeeeeeeeeeeeeeeeeeeeeeeeeeeeeeeeeeeeeeeeeeeeeeeeeeeeeeeeeeeee","operator_snapshot_hash":"blake3:ffffffffffffffffffffffffffffffffffffffffffffffffffffffffffffffff","plan_hash":"blake3:0123456789abcdef0123456789abcdef0123456789abcdef0123456789abcdef","policy_hash":"blake3:123456789abcdef0123456789abcdef0123456789abcdef0123456789abcdef0","profile_hash":"blake3:23456789abcdef0123456789abcdef0123456789abcdef0123456789abcdef01","registry_snapshot_hash":"blake3:3456789abcdef0123456789abcdef0123456789abcdef0123456789abcdef012","run_ledger_hash":"blake3:456789abcdef0123456789abcdef0123456789abcdef0123456789abcdef0123"},"coverage":{"breakdowns":[{"by":"isin_country_prefix","counts":{"attempted":3,"complete_empty":1,"complete_positive":2,"incomplete_authority":0,"incomplete_budget":0,"incomplete_evidence":0,"incomplete_execution":0,"incomplete_source":0,"not_investigated":0,"out_of_scope":0,"total":3},"key":"US"},{"by":"report_period","counts":{"attempted":3,"complete_empty":1,"complete_positive":2,"incomplete_authority":0,"incomplete_budget":0,"incomplete_evidence":0,"incomplete_execution":0,"incomplete_source":0,"not_investigated":0,"out_of_scope":0,"total":3},"key":"2024-09-30"}],"counts":{"attempted":3,"complete_empty":1,"complete_positive":2,"incomplete_authority":0,"incomplete_budget":0,"incomplete_evidence":0,"incomplete_execution":0,"incomplete_source":0,"not_investigated":0,"out_of_scope":0,"total":3},"universe_grain":"instrument_observation","universe_ref":"blake3:56789abcdef0123456789abcdef0123456789abcdef0123456789abcdef01234"},"human_review":{"adjudicated":1,"promoted":1,"queued":0},"policy_mappings":[{"from":"completion.require_every_subject_accounted","to":"coverage.total_accounted"}],"schema":"answer.v0","source_summary":{"channels":[{"artifacts":["artifact:blake3:1111111111111111111111111111111111111111111111111111111111111111"],"channel_key":"snowflake://edgar_db.dbt_wrangling_edgar/nport_holdings_authoritative","receipts":["receipt:blake3:6666666666666666666666666666666666666666666666666666666666666666"],"source_class":"landed_public"},{"artifacts":["artifact:blake3:3333333333333333333333333333333333333333333333333333333333333333"],"channel_key":"openfigi","receipts":["receipt:blake3:7777777777777777777777777777777777777777777777777777777777777777"],"source_class":"external_anchor_api"}]},"stopped_reason":null,"unknowns":{"evidentiary":[],"operational":[]}}
