{"answers":[{"answer_class":"indeterminate_evidence","contradiction_refs":[],"feasible_alternative_refs":["artifact:blake3:4444444444444444444444444444444444444444444444444444444444444444"],"subject_ref":"subject:nport:cusip-null:isin-XS0000000000:period-2024-09-30","support_refs":[],"value_ref":null}],"assumptions":[],"budget":{"consumed":{"bytes":920000000,"cost_units":5800,"human_reviews":488,"model_tokens":0,"source_calls":100000},"remaining":{"bytes":19080000000,"cost_units":4200,"human_reviews":12,"model_tokens":0,"source_calls":0}},"closure_refs":{"closure_root_hash":"blake3:aaaaaaaaaaaaaaaaaaaaaaaaaaaaaaaaaaaaaaaaaaaaaaaaaaaaaaaaaaaaaaab","declaration_hashes":["blake3:bbbbbbbbbbbbbbbbbbbbbbbbbbbbbbbbbbbbbbbbbbbbbbbbbbbbbbbbbbbbbbbc","blake3:cccccccccccccccccccccccccccccccccccccccccccccccccccccccccccccccd"],"grant_hash":"blake3:ddddddddddddddddddddddddddddddddddddddddddddddddddddddddddddddde","inquiry_hash":"blake3:eeeeeeeeeeeeeeeeeeeeeeeeeeeeeeeeeeeeeeeeeeeeeeeeeeeeeeeeeeeeeeef","operator_snapshot_hash":"blake3:fffffffffffffffffffffffffffffffffffffffffffffffffffffffffffffffe","plan_hash":"blake3:1123456789abcdef0123456789abcdef0123456789abcdef0123456789abcdea","policy_hash":"blake3:2222222222222222222222222222222222222222222222222222222222222222","profile_hash":"blake3:3333333333333333333333333333333333333333333333333333333333333333","registry_snapshot_hash":"blake3:4444444444444444444444444444444444444444444444444444444444444444","run_ledger_hash":"blake3:5555555555555555555555555555555555555555555555555555555555555555"},"coverage":{"breakdowns":[{"by":"isin_country_prefix","counts":{"attempted":2,"complete_empty":0,"complete_positive":1,"incomplete_authority":0,"incomplete_budget":0,"incomplete_evidence":1,"incomplete_execution":0,"incomplete_source":0,"not_investigated":0,"out_of_scope":0,"total":2},"key":"XS"},{"by":"report_period","counts":{"attempted":3,"complete_empty":0,"complete_positive":1,"incomplete_authority":0,"incomplete_budget":0,"incomplete_evidence":1,"incomplete_execution":0,"incomplete_source":1,"not_investigated":1,"out_of_scope":0,"total":4},"key":"2024-09-30"}],"counts":{"attempted":3,"complete_empty":0,"complete_positive":1,"incomplete_authority":0,"incomplete_budget":0,"incomplete_evidence":1,"incomplete_execution":0,"incomplete_source":1,"not_investigated":1,"out_of_scope":0,"total":4},"universe_grain":"instrument_observation","universe_ref":"blake3:66789abcdef0123456789abcdef0123456789abcdef0123456789abcdef01235"},"human_review":{"adjudicated":3,"promoted":1,"queued":12},"policy_mappings":[{"from":"completion.acceptable_unknowns","to":"evidence_missing"}],"schema":"answer.v0","source_summary":{"channels":[{"artifacts":["artifact:blake3:5555555555555555555555555555555555555555555555555555555555555555"],"channel_key":"snowflake://edgar_db.dbt_wrangling_edgar/nport_holdings_authoritative","receipts":["receipt:blake3:8888888888888888888888888888888888888888888888888888888888888888"],"source_class":"landed_public"},{"artifacts":[],"channel_key":"openfigi","receipts":["receipt:blake3:9999999999999999999999999999999999999999999999999999999999999999"],"source_class":"external_anchor_api"}]},"stopped_reason":"completed admitted work with answer-changing unknowns still open","unknowns":{"evidentiary":[{"can_change_answer":true,"class":"evidence_missing","closing_action":"acquire_an_independent_anchor_for_subject","description":"completed admitted sources found no comparable evidence for the subject","scope_ref":"artifact:blake3:5555555555555555555555555555555555555555555555555555555555555555"}],"operational":[{"can_change_answer":true,"class":"source_unavailable","closing_action":"retry_openfigi_when_budget_and_authority_are_available","description":"OpenFIGI resolution was unavailable for the bounded subject batch","scope_ref":null}]}}
